{
  "$schema": "../../schemas/jx-v5-solar-1pn-q3-oracle-registration-v1.schema.json",
  "schema": "jx-v5-solar-1pn-q3-oracle-registration/v1",
  "registration_id": "jx.v5.solar_1pn.q3_oracle_registration.v1",
  "qualification_id": "jx.v5.solar_1pn.qualification.78d05102bac2588b7677ec5ef19c653c0102923a1ab499852194f423c8911781",
  "status": "AWAITING_EXTERNAL_Q3_ORACLE_REGISTRATION",
  "design_only": true,
  "outcomes_generated": false,
  "execution_authorized": false,
  "registry_authorized": false,
  "evidence_class": "MODEL_OUTPUT",
  "protocol_constants": {
    "minimum_method_order": 8,
    "arithmetic": "ARBITRARY_PRECISION",
    "adaptive": true,
    "no_jx_imports_required": true,
    "force_ledger": [
      "force.newtonian.point_mass",
      "relativity.solar_schwarzschild_test_particle_1pn"
    ],
    "rhs_equation": "dr/dt=v;dv/dt=-mu*r/r^3+mu/(c^2*r^3)*((4*mu/r-v^2)*r+4*(r_dot_v)*v)",
    "checkpoint_schedule_refs": [
      "schedule.q2.e031.c83.h001.one_pn",
      "schedule.q2.e031.c97.h001.one_pn",
      "schedule.q2.e047.c83.h001.one_pn",
      "schedule.q2.e047.c97.h001.one_pn",
      "schedule.q3.generic.h001.one_pn"
    ],
    "per_checkpoint_required_fields": [
      "checkpoint_id",
      "checkpoint_epoch",
      "length_scale_lk",
      "velocity_scale_vk",
      "differential_signal_position_scale",
      "differential_signal_velocity_scale",
      "signal_floor",
      "component_treatment",
      "total_state_norm",
      "differential_signal_norm"
    ],
    "self_convergence_tolerance_levels": [
      "0.000000000000000000000000000001",
      "0.0000000000000000000000000000000000000001"
    ],
    "self_convergence_precision_context_refs": [
      "decimal.context.precision_50",
      "decimal.context.precision_70",
      "decimal.context.precision_90"
    ],
    "comparison_prohibited_until_self_convergence_passed": true
  },
  "method_requirements": {
    "method_id": {"status": "AWAITING_EXTERNAL_METHOD_ID", "value": null},
    "exact_order": {"status": "AWAITING_EXTERNAL_ORDER", "value": null},
    "source_citation": {"status": "AWAITING_EXTERNAL_SOURCE_CITATION", "value": null},
    "method_coefficients_binding": {"status": "AWAITING_EXTERNAL_COEFFICIENTS", "value": null},
    "rhs_transcription_binding": {"status": "AWAITING_EXTERNAL_RHS_TRANSCRIPTION", "value": null},
    "force_ledger_binding": {"status": "AWAITING_EXTERNAL_FORCE_LEDGER", "value": null},
    "error_control_policy": {"status": "AWAITING_EXTERNAL_ERROR_CONTROL_POLICY", "value": null},
    "dense_output_or_exact_checkpoint_policy": {"status": "AWAITING_EXTERNAL_CHECKPOINT_POLICY", "value": null},
    "event_handling": {"status": "AWAITING_EXTERNAL_EVENT_HANDLING", "value": null},
    "controller_binding": {"status": "AWAITING_EXTERNAL_CONTROLLER", "value": null}
  },
  "checkpoint_requirements": {
    "checkpoint_roster": {"status": "AWAITING_EXTERNAL_CHECKPOINT_ROSTER", "value": null},
    "per_checkpoint_metric_rows": {"status": "AWAITING_EXTERNAL_PER_CHECKPOINT_METRICS", "value": null}
  },
  "self_convergence": {
    "oracle_allocation_ref": {"status": "AWAITING_EXTERNAL_BUDGET", "value": null},
    "tolerance_convergence_result_binding": {"status": "AWAITING_EXTERNAL_SELF_CONVERGENCE_RESULT", "value": null},
    "precision_convergence_result_binding": {"status": "AWAITING_EXTERNAL_SELF_CONVERGENCE_RESULT", "value": null},
    "pass_attestation_binding": {"status": "AWAITING_EXTERNAL_SELF_CONVERGENCE_ATTESTATION", "value": null}
  },
  "external_bindings": {
    "oracle_source_binding": {"status": "AWAITING_EXTERNAL_SOURCE", "value": null},
    "oracle_runtime_binding": {"status": "AWAITING_EXTERNAL_RUNTIME", "value": null},
    "dependency_lock_binding": {"status": "AWAITING_EXTERNAL_DEPENDENCY_LOCK", "value": null},
    "oracle_configuration_binding": {"status": "AWAITING_EXTERNAL_CONFIGURATION", "value": null},
    "external_independence_binding": {"status": "AWAITING_EXTERNAL_INDEPENDENCE_ATTESTATION", "value": null},
    "sealed_expectation_binding": {"status": "AWAITING_EXTERNAL_SEALED_EXPECTATION", "value": null}
  },
  "ready": false,
  "nonclaim": "This null registration supplies no oracle, coefficients, controller, scales, norms, self-convergence result, expectation, or execution authority."
}
